{
  "seq": 10,
  "type": "quote.ready",
  "task_id": "tsk_01",
  "at": "2026-10-25T18:02:40Z",
  "data": {
    "call_id": "call_01",
    "task_id": "tsk_01",
    "place_id": "ChIJexample01",
    "offers": [
      {
        "part_type": {
          "value": "original",
          "value_min": null,
          "value_max": null,
          "status": "found",
          "confidence": 0.95,
          "evidence_quote": "الأصلي بألف ومتين",
          "evidence_turn": 3
        },
        "price_sar": {
          "value": 1200,
          "value_min": null,
          "value_max": null,
          "status": "found",
          "confidence": 0.9,
          "evidence_quote": "الأصلي بألف ومتين",
          "evidence_turn": 3
        },
        "warranty_days": {
          "value": null,
          "value_min": null,
          "value_max": null,
          "status": "refused",
          "confidence": 0.8,
          "evidence_quote": "الأصلي تعال المحل ونشوف",
          "evidence_turn": 7
        }
      },
      {
        "part_type": {
          "value": "commercial",
          "value_min": null,
          "value_max": null,
          "status": "found",
          "confidence": 0.95,
          "evidence_quote": "والتجاري بأربعمية وخمسين",
          "evidence_turn": 3
        },
        "price_sar": {
          "value": 450,
          "value_min": null,
          "value_max": null,
          "status": "found",
          "confidence": 0.9,
          "evidence_quote": "والتجاري بأربعمية وخمسين",
          "evidence_turn": 3
        },
        "warranty_days": {
          "value": 30,
          "value_min": null,
          "value_max": null,
          "status": "found",
          "confidence": 0.9,
          "evidence_quote": "التجاري عليه ضمان شهر",
          "evidence_turn": 7
        }
      }
    ],
    "fields": {
      "turnaround_minutes": {
        "value": null,
        "value_min": 60,
        "value_max": 120,
        "status": "found",
        "confidence": 0.85,
        "evidence_quote": "من ساعة لساعتين",
        "evidence_turn": 9
      },
      "availability": {
        "value": "in_stock",
        "value_min": null,
        "value_max": null,
        "status": "found",
        "confidence": 0.9,
        "evidence_quote": "موجودة",
        "evidence_turn": 11
      }
    },
    "answers": [
      {
        "question_index": 0,
        "question": "يصلحونه قدامي ولا أتركه عندهم؟",
        "status": "found",
        "summary_ar": "يصلحونه قدام العميل وهو ينتظر في المحل.",
        "evidence": [
          {
            "quote": "تقعد وتشوفه قدامك",
            "turn": 13
          }
        ]
      }
    ],
    "evidence_issues": []
  }
}
